{
  "v": "HBCE-EVIDENCE-1",
  "request_id": "11111111-1111-1111-1111-111111111111",
  "ipr_subject": "IPR-USER-0001",
  "ts": {
    "start": "2026-03-02T10:00:00Z",
    "end": "2026-03-02T10:00:01Z"
  },
  "policy": {
    "id": "HBCE-POLICY-CORE",
    "version": "1.0.0",
    "result": "PASS",
    "reasons": []
  },
  "gate": {
    "result": "ALLOW",
    "reasons": []
  },
  "hashes": {
    "input_hash": "aaaaaaaaaaaaaaaaaaaaaaaaaaaaaaaaaaaaaaaaaaaaaaaaaaaaaaaaaaaaaaaa",
    "plan_hash": "bbbbbbbbbbbbbbbbbbbbbbbbbbbbbbbbbbbbbbbbbbbbbbbbbbbbbbbbbbbbbbbb",
    "output_hash": "cccccccccccccccccccccccccccccccccccccccccccccccccccccccccccccccc"
  },
  "exec": {
    "status": "OK",
    "tool_trace": ["policy_reader"]
  },
  "chain": {
    "prev_entry_hash": "GENESIS",
    "entry_hash": "dddddddddddddddddddddddddddddddddddddddddddddddddddddddddddddddd",
    "height": 1
  },
  "sig": {
    "alg": "ed25519",
    "by": "JOKER-C2",
    "value": "SIGNATURE_PLACEHOLDER"
  }
}
